"user_id","Informazioni cronologiche","(Supervisor) Quin mode has testejat:","Com descriuries la teva experiència global amb l'aplicació de la llista de la compra i el robot guia?","Va ser la interfície d'usuari de l'aplicació de la llista de la compra intuitiva i fàcil de navegar?","Al final, vas acabar utilitzant el sistema de navegació de l'aplicació?","Hi va haver algun cas específic on la guia del robot va ser especialment útil o insuficient?","Quina creus que va ser la diferència de velocitat en la teva experiència de compra utilitzant el robot guía, més ràpida o més lenta?","Com valores la velocitat del robot?","Quin nivell de comoditat vas sentir en dependre d'un robot per guiar-te pel supermercat?","Basant-te en la teva experiència amb la simulació, quina és la teva probabilitat d'utilitzar una aplicació de llista de la compra amb un robot guia en un escenari real?","Creus que la presència de clients a la simulació ha millorat o empitjorat la teva experiència amb el robot?","Hi ha alguna característica o funcionalitat específica que t'agradaria veure millorada o afegida a l'aplicació o al robot guia?","Hi ha alguna altra cosa que vulguis compartir sobre la teva experiència o algun altre comentari que vulguis fer?","Simpatia 1","Simpatia 2","Simpatia 3","Simpatia 4","Simpatia 5","Intel·ligència percebuda 1","Intel·ligència percebuda 2","Intel·ligència percebuda 3","Intel·ligència percebuda 4","Intel·ligència percebuda 5","Seguretat percebuda 1","Seguretat percebuda 2","Seguretat percebuda 3",""
"AC1","2023/12/26 5:29:50 PM CET","A","3","No","No","útil, millores: el robot no s'espera, es queda el mitg","1.5 vegades més ràpid","3","4","1","","no cal un carro que marxi, posaría una pantalla en el carro amb el recorregut a fer","`¡","2","4","2","2","3","4","1","5","1","3","2","3","2","3"
"AC2","2023/12/26 6:16:15 PM CET","B","3","Sí","No","Quan és la primera vegada que entres al supermercat  i no tens clar on estan les seccions. ","Igual","3","5","2","","Millorar les reaccions del robot a canvis sobtats de l'usuari. Que parli en català i utilitzi convencions del llenguatge humà (""bon dia"", ""fins una altre"", etc.). ","Tot bé, però caldria provar en un context amb diversos robots cistella simultanis. ","2","2","4","3","4","2","3","5","3","5","5","1","3","3"
"AC3","2023/12/28 8:05:59 PM CET","A","4","Sí","Sí","El mapa ha estat molt útil. Si un sap on són els productes el robot és innecessari.","2 vegades més ràpida o més","3","3","3","3","El robot va a batzegades","El robot no cal","2","4","3","2","3","4","3","5","4","5","5","1","5",""
"AC4","2023/12/28 10:13:08 PM CET","A","5","Sí","Sí","Sí , per guanyar temps en la compra","2 vegades més ràpida o més","5","5","5","4","No","no","5","5","5","5","5","4","4","4","4","5","4","1","4",""
"AC5","2023/12/30 1:00:17 PM CET","B","4","Sí","No","Ha hagut un cas on el robot no m'ha portat on tocava i he agafat el producte de camí a un altre producte.","1.5 vegades més lent","2","4","4","3","Que el carro vagi més ràpid. El client caminava més ràpid.","No.","4","4","5","4","3","4","3","5","3","3","4","2","3",""
"AC6","2023/12/30 8:20:37 PM CET","B","4","Sí","No","Sí. Per localitzar els productes","2 vegades més ràpida o més","2","3","3","2","No","Disminuiria la velocitat / sensibilitat de la càmara amb el ratolí i augmentaria la velocitat de moviment amb les tecles","4","4","4","4","3","4","4","4","3","4","4","2","2",""
"AC7","2024/01/01 6:56:16 PM CET","A","1","Sí","No","Bastant difícil","1.5 vegades més lent","5","2","4","2","Que estigui en català","Massa difícil per a mi","2","2","3","2","2","4","3","4","4","3","2","2","2",""
"AC8",2024/01/06 7:00:45 PM CET,"B","3","Sí","Sí","m'ha portat per llocs on no tocava i he hagut de portar jo al robot","1.5 vegades més lent","3","2","2","2","si, que parli en catala o en en l'idioma de l'usuari","-","4","3","4","4","4","2","2","4","3","2","2","3","4",""